{
  "schema_version": 1,
  "workflow_id": "idea-to-mvp",
  "mode": "guided",
  "current_phase": "discover",
  "current_node": 1,
  "nodes": [
    {
      "node": 1,
      "phase": "discover",
      "status": "recoverable"
    },
    {
      "node": 2,
      "phase": "discover",
      "status": "pending"
    },
    {
      "node": 3,
      "phase": "discover",
      "status": "pending"
    },
    {
      "node": 4,
      "phase": "discover",
      "status": "pending"
    },
    {
      "node": 5,
      "phase": "discover",
      "status": "pending"
    },
    {
      "node": 6,
      "phase": "discover",
      "status": "pending"
    },
    {
      "node": 7,
      "phase": "define",
      "status": "pending"
    },
    {
      "node": 8,
      "phase": "define",
      "status": "pending"
    },
    {
      "node": 9,
      "phase": "define",
      "status": "pending"
    },
    {
      "node": 10,
      "phase": "define",
      "status": "pending"
    },
    {
      "node": 11,
      "phase": "define",
      "status": "pending"
    },
    {
      "node": 12,
      "phase": "define",
      "status": "pending"
    },
    {
      "node": 13,
      "phase": "design",
      "status": "pending"
    },
    {
      "node": 14,
      "phase": "design",
      "status": "pending"
    },
    {
      "node": 15,
      "phase": "design",
      "status": "pending"
    },
    {
      "node": 16,
      "phase": "design",
      "status": "pending"
    },
    {
      "node": 17,
      "phase": "design",
      "status": "pending"
    },
    {
      "node": 18,
      "phase": "build",
      "status": "pending"
    },
    {
      "node": 19,
      "phase": "build",
      "status": "pending"
    },
    {
      "node": 20,
      "phase": "build",
      "status": "pending"
    },
    {
      "node": 21,
      "phase": "build",
      "status": "pending"
    },
    {
      "node": 22,
      "phase": "build",
      "status": "pending"
    },
    {
      "node": 23,
      "phase": "build",
      "status": "pending"
    },
    {
      "node": 24,
      "phase": "test",
      "status": "pending"
    },
    {
      "node": 25,
      "phase": "test",
      "status": "pending"
    },
    {
      "node": 26,
      "phase": "test",
      "status": "pending"
    },
    {
      "node": 27,
      "phase": "test",
      "status": "pending"
    },
    {
      "node": 28,
      "phase": "test",
      "status": "pending"
    },
    {
      "node": 29,
      "phase": "launch",
      "status": "pending"
    },
    {
      "node": 30,
      "phase": "launch",
      "status": "pending"
    },
    {
      "node": 31,
      "phase": "launch",
      "status": "pending"
    },
    {
      "node": 32,
      "phase": "feedback",
      "status": "pending"
    },
    {
      "node": 33,
      "phase": "feedback",
      "status": "pending"
    }
  ],
  "blockers": [],
  "required_human_decisions": [],
  "updated_at": "2026-07-20T01:45:12+00:00"
}
